{
  "collection_id": "raw_manual_review_20260805_000001",
  "collection_run_id": "run_manual_review_20260805_000001",
  "source_id": "district",
  "source_record_identifier": "terms_review",
  "parent_collection_id": null,
  "requested_url": "https://www.district.in/policies/terms-of-service",
  "canonical_url": "https://www.district.in/policies/terms-of-service",
  "request_method": "MANUAL",
  "request_headers_safe": {
    "accept": "text/html"
  },
  "request_parameters_safe": {},
  "collection_method": "terms_review",
  "collector_name": "manual_source_review",
  "collector_version": "0.1.0",
  "requested_at": "2026-08-05T12:00:00-04:00",
  "response_received_at": "2026-08-05T12:00:01-04:00",
  "collected_at": "2026-08-05T12:00:02-04:00",
  "source_event_time": null,
  "collection_duration_ms": 1000,
  "http_status": 200,
  "content_type": "text/html",
  "content_encoding": "utf-8",
  "response_size_bytes": 12345,
  "content_hash_sha256": "aaaaaaaaaaaaaaaaaaaaaaaaaaaaaaaaaaaaaaaaaaaaaaaaaaaaaaaaaaaaaaaa",
  "raw_storage_path": "data/raw/manual_review/district_terms_20260805.html",
  "response_language": "en",
  "final_url": "https://www.district.in/policies/terms-of-service",
  "redirect_count": 0,
  "source_review_id": "district_preliminary_2026_08_05",
  "collection_decision": "pending_review",
  "terms_reviewed_at": "2026-08-05T12:00:00-04:00",
  "robots_reviewed_at": null,
  "permission_basis": "manual_feasibility_observation_only",
  "attribution_required": false,
  "retention_policy": "review_notes_only_until_permission",
  "contains_personal_data": false,
  "personal_data_notes": null,
  "success": true,
  "error_type": null,
  "error_message_safe": null,
  "retry_count": 0,
  "rate_limit_observed": false,
  "parser_status": "skipped",
  "validation_status": "valid",
  "notes": "Fixture validates metadata only; no workshop payload collection is approved.",
  "git_commit_sha": "c418ca0325f806a0089097c12c5dd93043b5808c",
  "python_version": "3.12",
  "environment_name": "local",
  "schema_version": "1.0.0"
}
